{
  "schemaVersion": "2.0.0",
  "tenant": "bkwatch",
  "clientSafe": true,
  "asOf": "2026-07-21",
  "entries": [
    {
      "id": "film1-shaw-bkwatch",
      "type": "project",
      "title": "shaw-bkWatch",
      "excerpt": "Teams can add specialized bankruptcy automation without leaving the loan management platform they already use.",
      "project": "shaw-bkWatch",
      "status": "Active",
      "format": "project",
      "date": "2026-07-21",
      "route": "/bkwatch/projects/film1-shaw-bkwatch"
    },
    {
      "id": "film1-shaw-bkwatch:final-demo",
      "type": "film-idea",
      "title": "Final Demo",
      "excerpt": "Real Spectrum becomes an intricate physical dashboard, reveals BankruptcyWatch working beneath it, resolves three handled outcomes, and returns to the same active lender workflow.",
      "project": "shaw-bkWatch",
      "status": "Selected — demo in production",
      "format": "film knowledge",
      "route": "/bkwatch/projects/film1-shaw-bkwatch#selected-demo"
    },
    {
      "id": "film1-shaw-bkwatch:final-demo:scene-1",
      "type": "scene",
      "title": "scene-1 · Scene 1 — Spectrum is already home",
      "excerpt": "A simple over-the-shoulder push frames a woman working while approved real Spectrum fills more than 80 percent of the monitor and the lender floor remains active behind her.",
      "project": "shaw-bkWatch",
      "status": "Instructions ready — video not started",
      "format": "scene",
      "route": "/bkwatch/projects/film1-shaw-bkwatch#scene-1"
    },
    {
      "id": "film1-shaw-bkwatch:final-demo:scene-2",
      "type": "scene",
      "title": "scene-2 · Scene 2 — The filing arrives",
      "excerpt": "The physical filing object lowers perfectly vertically, hovers between the specialist and monitor, and begins moving toward Spectrum after one keyboard input.",
      "project": "shaw-bkWatch",
      "status": "Instructions approved — video not started",
      "format": "scene",
      "route": "/bkwatch/projects/film1-shaw-bkwatch#scene-2"
    },
    {
      "id": "film1-shaw-bkwatch:final-demo:scene-3",
      "type": "scene",
      "title": "scene-3 · Scene 3 — Spectrum becomes physical",
      "excerpt": "The approved real interface gains depth as the camera orbits and sweeps into a city-like physical dashboard. The filing clicks into a prepared slot, one blue pulse crosses the rece",
      "project": "shaw-bkWatch",
      "status": "Draft instructions approved — need software screenshots before video",
      "format": "scene",
      "route": "/bkwatch/projects/film1-shaw-bkwatch#scene-3"
    },
    {
      "id": "film1-shaw-bkwatch:final-demo:scene-4",
      "type": "scene",
      "title": "scene-4 · Scene 4 — Why the platform knows",
      "excerpt": "The Spectrum top layer rises as one rigid precision assembly, revealing an intricate black-and-blue BankruptcyWatch mechanism beneath it. One restrained pulse travels outward befor",
      "project": "shaw-bkWatch",
      "status": "Draft instructions ready — need logos and animation frames before video",
      "format": "scene",
      "route": "/bkwatch/projects/film1-shaw-bkwatch#scene-4"
    },
    {
      "id": "film1-shaw-bkwatch:final-demo:scene-5",
      "type": "scene",
      "title": "scene-5 · Scene 5 — Handled-state hero",
      "excerpt": "Status, Tasks, and Credit complete one at a time. Each check sends one green signal to a linked dashboard region; all three cards, paths, and targets remain illuminated as the came",
      "project": "shaw-bkWatch",
      "status": "Draft instructions ready — need feature and color approval before video",
      "format": "scene",
      "route": "/bkwatch/projects/film1-shaw-bkwatch#scene-5"
    },
    {
      "id": "film1-shaw-bkwatch:final-demo:scene-6",
      "type": "scene",
      "title": "scene-6 · Scene 6 — Same Spectrum, more capable",
      "excerpt": "The view returns to the original over-the-shoulder workplace. The specialist performs another task while meaningful approved state changes occur in Spectrum and the active floor co",
      "project": "shaw-bkWatch",
      "status": "Instructions ready — need final software screenshots and logos before video",
      "format": "scene",
      "route": "/bkwatch/projects/film1-shaw-bkwatch#scene-6"
    },
    {
      "id": "film1-shaw-bkwatch:already-inside-spectrum",
      "type": "film-idea",
      "title": "Already Inside Spectrum",
      "excerpt": "A direct product-proof control: one filing arrives, seats natively, and resolves into three handled Spectrum states.",
      "project": "shaw-bkWatch",
      "status": "Supporting study",
      "format": "film knowledge",
      "route": "/bkwatch/projects/film1-shaw-bkwatch/ideas/already-inside-spectrum"
    },
    {
      "id": "film1-shaw-bkwatch:already-inside-spectrum:study-1-scene-1",
      "type": "scene",
      "title": "study-1-scene-1 · Study 1, Scene 1 — Home base",
      "excerpt": "A stable Spectrum view holds center while one filing approaches and a receiving point appears.",
      "project": "shaw-bkWatch",
      "status": "Not started",
      "format": "scene",
      "route": "/bkwatch/projects/film1-shaw-bkwatch/ideas/already-inside-spectrum#study-1-scene-1"
    },
    {
      "id": "film1-shaw-bkwatch:already-inside-spectrum:study-1-scene-2",
      "type": "scene",
      "title": "study-1-scene-2 · Study 1, Scene 2 — Native arrival",
      "excerpt": "The filing travels through a direct native route and seats in the case area.",
      "project": "shaw-bkWatch",
      "status": "Not started",
      "format": "scene",
      "route": "/bkwatch/projects/film1-shaw-bkwatch/ideas/already-inside-spectrum#study-1-scene-2"
    },
    {
      "id": "film1-shaw-bkwatch:already-inside-spectrum:study-1-scene-3",
      "type": "scene",
      "title": "study-1-scene-3 · Study 1, Scene 3 — Handled",
      "excerpt": "Status, task, and reporting regions settle in order.",
      "project": "shaw-bkWatch",
      "status": "Not started",
      "format": "scene",
      "route": "/bkwatch/projects/film1-shaw-bkwatch/ideas/already-inside-spectrum#study-1-scene-3"
    },
    {
      "id": "film1-shaw-bkwatch:the-moment-it-lands",
      "type": "film-idea",
      "title": "The Moment It Lands",
      "excerpt": "A filing lands with controlled kinetic force, opening one blue seam that becomes three ordered outcomes.",
      "project": "shaw-bkWatch",
      "status": "Supporting study",
      "format": "film knowledge",
      "route": "/bkwatch/projects/film1-shaw-bkwatch/ideas/the-moment-it-lands"
    },
    {
      "id": "film1-shaw-bkwatch:the-moment-it-lands:study-2-scene-1",
      "type": "scene",
      "title": "study-2-scene-1 · Study 2, Scene 1 — Approach",
      "excerpt": "A close-up account field sits on a Spectrum-derived plane as a filing descends toward one receiving slot.",
      "project": "shaw-bkWatch",
      "status": "Not started",
      "format": "scene",
      "route": "/bkwatch/projects/film1-shaw-bkwatch/ideas/the-moment-it-lands#study-2-scene-1"
    },
    {
      "id": "film1-shaw-bkwatch:the-moment-it-lands:study-2-scene-2",
      "type": "scene",
      "title": "study-2-scene-2 · Study 2, Scene 2 — Impact",
      "excerpt": "The filing lands edge-first; one blue seam opens and divides into three tracks.",
      "project": "shaw-bkWatch",
      "status": "Not started",
      "format": "scene",
      "route": "/bkwatch/projects/film1-shaw-bkwatch/ideas/the-moment-it-lands#study-2-scene-2"
    },
    {
      "id": "film1-shaw-bkwatch:the-moment-it-lands:study-2-scene-3",
      "type": "scene",
      "title": "study-2-scene-3 · Study 2, Scene 3 — Consequence",
      "excerpt": "Three physical tabs use a matching transition to three ordered Spectrum states.",
      "project": "shaw-bkWatch",
      "status": "Not started",
      "format": "scene",
      "route": "/bkwatch/projects/film1-shaw-bkwatch/ideas/the-moment-it-lands#study-2-scene-3"
    },
    {
      "id": "film1-shaw-bkwatch:one-desk-no-detours",
      "type": "film-idea",
      "title": "One Desk. No Detours.",
      "excerpt": "External court information folds into one native folio and docks without breaking the specialist's desk workflow.",
      "project": "shaw-bkWatch",
      "status": "Supporting study",
      "format": "film knowledge",
      "route": "/bkwatch/projects/film1-shaw-bkwatch/ideas/one-desk-no-detours"
    },
    {
      "id": "film1-shaw-bkwatch:one-desk-no-detours:study-3-scene-1",
      "type": "scene",
      "title": "study-3-scene-1 · Study 3, Scene 1 — Outside pull",
      "excerpt": "A specialist and Spectrum remain central while three translucent document planes enter the desk perimeter.",
      "project": "shaw-bkWatch",
      "status": "Not started",
      "format": "scene",
      "route": "/bkwatch/projects/film1-shaw-bkwatch/ideas/one-desk-no-detours#study-3-scene-1"
    },
    {
      "id": "film1-shaw-bkwatch:one-desk-no-detours:study-3-scene-2",
      "type": "scene",
      "title": "study-3-scene-2 · Study 3, Scene 2 — Native fold",
      "excerpt": "The planes hinge into one blue-bound folio and dock at the monitor edge.",
      "project": "shaw-bkWatch",
      "status": "Not started",
      "format": "scene",
      "route": "/bkwatch/projects/film1-shaw-bkwatch/ideas/one-desk-no-detours#study-3-scene-2"
    },
    {
      "id": "film1-shaw-bkwatch:one-desk-no-detours:study-3-scene-3",
      "type": "scene",
      "title": "study-3-scene-3 · Study 3, Scene 3 — Same desk",
      "excerpt": "One hand input settles task and status inside Spectrum; no extra app or operator appears.",
      "project": "shaw-bkWatch",
      "status": "Not started",
      "format": "scene",
      "route": "/bkwatch/projects/film1-shaw-bkwatch/ideas/one-desk-no-detours#study-3-scene-3"
    },
    {
      "id": "film1-shaw-bkwatch:confidence-before-motion",
      "type": "film-idea",
      "title": "Confidence Before Motion",